{
  "generated_at": "2026-09-28T06:02:11-05:00",
  "date": "2026-09-28",
  "timezone": "America/Chicago",
  "owner": "Margaret",
  "headline": "Two overlapping calls late morning, otherwise a normal Monday with QCA needing the most attention.",
  "day_shape": "normal",
  "goals": [
    {
      "id": "atwc-q4-waitlist-conversion",
      "title": "Convert 70 percent of the ATWC waitlist",
      "business": "atwc",
      "target": 70,
      "current": 62,
      "unit": "pct",
      "due": "2026-12-31",
      "status": "at_risk",
      "note": "Up 4 points since the start of the month."
    },
    {
      "id": "qca-q4-gp",
      "title": "Every active QCA job above 40 percent gross profit",
      "business": "qca",
      "target": 12,
      "current": 10,
      "unit": "jobs",
      "due": "2026-12-31",
      "status": "behind",
      "note": "Two jobs are under the line. See the WIP card."
    },
    {
      "id": "qca-cash",
      "title": "Collect on finished QCA jobs within 30 days",
      "business": "qca",
      "target": 30,
      "current": 27,
      "unit": "days",
      "due": "2026-12-31",
      "status": "on_track"
    },
    {
      "id": "personal-reading",
      "title": "Read 12 books this year",
      "business": "personal",
      "target": 12,
      "current": 9,
      "unit": "books",
      "due": "2026-12-31",
      "status": "on_track"
    }
  ],
  "calendar": {
    "accounts": [
      {"email": "margaret@mytherapywellness.com", "business": "atwc", "label": "ATWC calendar"},
      {"email": "margaret@qcaroofing.example", "business": "qca", "label": "QCA calendar"}
    ],
    "events": [
      {
        "id": "ev-001",
        "account": "margaret@mytherapywellness.com",
        "business": "atwc",
        "title": "Team huddle",
        "start": "2026-09-28T08:00:00-05:00",
        "end": "2026-09-28T08:30:00-05:00",
        "all_day": false,
        "location": "Clinic, front office",
        "attendees_count": 6,
        "organizer_is_me": true,
        "response": "owner",
        "link": "https://calendar.google.com/calendar/event?eid=example-ev-001",
        "conflict": false,
        "day": "today"
      },
      {
        "id": "ev-002",
        "account": "margaret@mytherapywellness.com",
        "business": "atwc",
        "title": "Evaluation block, two new families",
        "start": "2026-09-28T09:00:00-05:00",
        "end": "2026-09-28T10:30:00-05:00",
        "all_day": false,
        "location": "Clinic, room 2",
        "attendees_count": 1,
        "organizer_is_me": true,
        "response": "owner",
        "link": "https://calendar.google.com/calendar/event?eid=example-ev-002",
        "conflict": false,
        "day": "today"
      },
      {
        "id": "ev-003",
        "account": "margaret@qcaroofing.example",
        "business": "qca",
        "title": "Site walk, Pinecrest Drive re-roof",
        "start": "2026-09-28T10:30:00-05:00",
        "end": "2026-09-28T11:15:00-05:00",
        "all_day": false,
        "location": "1412 Pinecrest Dr",
        "attendees_count": 3,
        "organizer_is_me": false,
        "response": "accepted",
        "link": "https://calendar.google.com/calendar/event?eid=example-ev-003",
        "conflict": true,
        "day": "today"
      },
      {
        "id": "ev-004",
        "account": "margaret@mytherapywellness.com",
        "business": "atwc",
        "title": "Call with Brightline Insurance about superbills",
        "start": "2026-09-28T10:45:00-05:00",
        "end": "2026-09-28T11:30:00-05:00",
        "all_day": false,
        "attendees_count": 2,
        "organizer_is_me": false,
        "response": "tentative",
        "link": "https://calendar.google.com/calendar/event?eid=example-ev-004",
        "conflict": true,
        "day": "today"
      },
      {
        "id": "ev-005",
        "account": "margaret@qcaroofing.example",
        "business": "qca",
        "title": "Permit office follow-up, Oakridge HOA",
        "start": "2026-09-28T13:00:00-05:00",
        "end": "2026-09-28T14:00:00-05:00",
        "all_day": false,
        "location": "County building, 3rd floor",
        "attendees_count": 2,
        "organizer_is_me": true,
        "response": "owner",
        "link": "https://calendar.google.com/calendar/event?eid=example-ev-005",
        "conflict": false,
        "day": "today"
      },
      {
        "id": "ev-006",
        "account": "margaret@mytherapywellness.com",
        "business": "personal",
        "title": "Dentist, kids",
        "start": "2026-09-28T16:00:00-05:00",
        "end": "2026-09-28T16:45:00-05:00",
        "all_day": false,
        "attendees_count": 1,
        "organizer_is_me": true,
        "response": "owner",
        "link": "https://calendar.google.com/calendar/event?eid=example-ev-006",
        "conflict": false,
        "day": "today"
      },
      {
        "id": "ev-007",
        "account": "margaret@mytherapywellness.com",
        "business": "atwc",
        "title": "Marketing review with Kelsey",
        "start": "2026-09-29T09:00:00-05:00",
        "end": "2026-09-29T09:45:00-05:00",
        "all_day": false,
        "attendees_count": 2,
        "organizer_is_me": true,
        "response": "owner",
        "link": "https://calendar.google.com/calendar/event?eid=example-ev-007",
        "conflict": false,
        "day": "tomorrow"
      },
      {
        "id": "ev-008",
        "account": "margaret@qcaroofing.example",
        "business": "qca",
        "title": "Riverbend Supply, shingle pricing for Q4",
        "start": "2026-09-29T14:00:00-05:00",
        "end": "2026-09-29T14:30:00-05:00",
        "all_day": false,
        "attendees_count": 2,
        "organizer_is_me": false,
        "response": "accepted",
        "link": "https://calendar.google.com/calendar/event?eid=example-ev-008",
        "conflict": false,
        "day": "tomorrow"
      }
    ]
  },
  "email": {
    "accounts": [
      {"email": "margaret@mytherapywellness.com", "business": "atwc", "label": "ATWC inbox"},
      {"email": "margaret@qcaroofing.example", "business": "qca", "label": "QCA inbox"}
    ],
    "counts": {"unread": 23, "needs_reply": 4, "waiting_on": 2},
    "needs_reply": [
      {
        "id": "th-101",
        "account": "margaret@mytherapywellness.com",
        "business": "atwc",
        "from": "Dana Whitfield, Brightline Insurance",
        "subject": "Question about your superbill format",
        "received": "2026-09-28T01:10:00-05:00",
        "age_hours": 5,
        "snippet": "Before our call, could you confirm which CPT codes you list on the superbill so we can...",
        "link": "https://mail.google.com/mail/u/0/#inbox/example-th-101"
      },
      {
        "id": "th-102",
        "account": "margaret@qcaroofing.example",
        "business": "qca",
        "from": "Tom Alvarez",
        "subject": "Re: Pinecrest Drive estimate revision",
        "received": "2026-09-27T04:00:00-05:00",
        "age_hours": 26,
        "snippet": "Thanks for the updated numbers. Can we drop the gutter guards and see where that lands...",
        "link": "https://mail.google.com/mail/u/1/#inbox/example-th-102"
      },
      {
        "id": "th-103",
        "account": "margaret@mytherapywellness.com",
        "business": "atwc",
        "from": "Priya Natarajan, Hartwell Pediatrics",
        "subject": "How your referral process works",
        "received": "2026-09-28T03:05:00-05:00",
        "age_hours": 3,
        "snippet": "Our front desk asked me how you like referrals sent over. Fax, portal, or email?",
        "link": "https://mail.google.com/mail/u/0/#inbox/example-th-103"
      },
      {
        "id": "th-104",
        "account": "margaret@mytherapywellness.com",
        "business": "atwc",
        "from": "Kelsey Moran",
        "subject": "Podcast guest slot in October",
        "received": "2026-09-26T02:00:00-05:00",
        "age_hours": 52,
        "snippet": "The Feeding Matters show has a Tuesday slot open on the 14th or the 21st. Which works?",
        "link": "https://mail.google.com/mail/u/0/#inbox/example-th-104"
      }
    ],
    "waiting_on": [
      {
        "id": "th-201",
        "account": "margaret@qcaroofing.example",
        "business": "qca",
        "from": "Riverbend Supply",
        "subject": "Quote 4471, metal flashing",
        "received": "2026-09-25T06:00:00-05:00",
        "age_hours": 72,
        "snippet": "You asked for the updated quote on Thursday. No reply yet.",
        "link": "https://mail.google.com/mail/u/1/#sent/example-th-201"
      },
      {
        "id": "th-202",
        "account": "margaret@mytherapywellness.com",
        "business": "atwc",
        "from": "Ledgerly Bookkeeping",
        "subject": "August close, two open questions",
        "received": "2026-09-24T06:00:00-05:00",
        "age_hours": 96,
        "snippet": "You answered both questions Wednesday. Still waiting on the closed books.",
        "link": "https://mail.google.com/mail/u/0/#sent/example-th-202"
      }
    ]
  },
  "tasks": {
    "source": "Asana",
    "due_today": [
      {"id": "t-1", "title": "Approve October staff schedule", "project": "ATWC Ops", "business": "atwc", "due": "2026-09-28", "link": "https://app.asana.com/0/example/t-1"},
      {"id": "t-2", "title": "Send revised Pinecrest estimate", "project": "QCA Sales", "business": "qca", "due": "2026-09-28", "link": "https://app.asana.com/0/example/t-2"},
      {"id": "t-3", "title": "Record intro for the feeding workshop", "project": "ATWC Marketing", "business": "atwc", "due": "2026-09-28", "link": "https://app.asana.com/0/example/t-3"}
    ],
    "overdue": [
      {"id": "t-4", "title": "Sign the Oakridge HOA change order", "project": "QCA Jobs", "business": "qca", "due": "2026-09-25", "link": "https://app.asana.com/0/example/t-4"},